key,lastInstantiationMoment,title,author,message,emailAddress,link
notice_07,2021/08/23 20:00,this is a message,message writer,message content,null,null
notice_08,2020/03/03 15:00,birthday,me,happy birthday to you,birthdaycelebrator@gmail.com,null
notice_09,2021/05/17 06:09,never,gonna,give,you@gmail.com,https://www.youtube.com/watch?v=dQw4w9WgXcQ
notice_10,2021/05/17 00:00,this should pass the test for max length while being exactly 75 words long!,yes,no,null,null
notice_11,2021/05/17 00:00,yes,this should pass the test for max length while being exactly 75 words long!,no,null,null
notice_12,2021/05/17 00:00,yes,no,this should pass the test for max length while being exactly 75 words long but it's actually 100!!!!,null,null
